nameOfIssuer	titleOfClass	cusip	value	sshPrnamt	sshPrnamtType	investmentDiscretion	Sole	Shared	None
GENESEE  WYO INC CL A	COM	371559105	46810	678902	SH	SOLE	630446	0	48456
GENOMIC HEALTH INC COM	COM	37244C101	4289	148314	SH	SOLE	148314	0	0
GENOMIC HEALTH INC COM	COM	37244C101	990	34248	SH	OTR	34248	0	0
GENUINE PARTS CO COM	COM	372460105	15781	157100	SH	SOLE	157100	0	0
GIBRALTAR INDS INC COM	COM	374689107	37398	1006671	SH	SOLE	1006671	0	0
GIGAMON INC COM	COM	37518B102	39214	715579	SH	SOLE	698329	0	17250
GIGAMON INC COM	COM	37518B102	600	10952	SH	OTR	10952	0	0
GILEAD SCIENCES INC COM	COM	375558103	12383	156505	SH	SOLE	156505	0	0
GLAUKOS CORP COM	COM	377322102	66657	1766209	SH	SOLE	1737116	0	29093
GLAUKOS CORP COM	COM	377322102	1744	46210	SH	OTR	46210	0	0
GODADDY INC CL A	COM	380237107	42812	1239840	SH	SOLE	1222516	0	17324
GOODYEAR TIRE  RUBR CO COM	COM	382550101	7713	238800	SH	SOLE	238800	0	0
GRACO INC COM	COM	384109104	17338	234300	SH	SOLE	234300	0	0
GRANITE CONSTR INC COM	COM	387328107	20286	407838	SH	SOLE	407838	0	0
GRAPHIC PACKAGING HLDG CO COM	COM	388689101	30661	2191626	SH	SOLE	2191626	0	0
GREAT PLAINS ENERGY INC COM	COM	391164100	36387	1333353	SH	SOLE	1333353	0	0
GREEN PLAINS INC NOTE 3.250%10/0	CV	393222AD6	2540	1827000	PRN	SOLE	1827000	0	0
GRUBHUB INC COM	COM	400110102	109977	2558201	SH	SOLE	2518045	0	40156
GRUPO FINANCIERO SANTANDER M SPON ADR SHS B	ADR	40053C105	138	15678	SH	SOLE	7934	0	7744
GRUPO FINANCIERO SANTANDER M SPON ADR SHS B	ADR	40053C105	6	675	SH	OTR	0	0	675
HCP INC COM	COM	40414L109	5359	141200	SH	SOLE	141200	0	0
HD SUPPLY HLDGS INC COM	COM	40416M105	4735	148070	SH	SOLE	148070	0	0
HAIN CELESTIAL GROUP INC COM	COM	405217100	3899	109579	SH	SOLE	109579	0	0
HALLIBURTON CO COM	COM	406216101	109091	2430717	SH	SOLE	2357000	0	73717
HALLIBURTON CO COM	COM	406216101	124	2760	SH	OTR	0	0	2760
HANESBRANDS INC COM	COM	410345102	6171	244402	SH	SOLE	244402	0	0
HANNON ARMSTRONG SUST INFR C COM	COM	41068X100	4251	181894	SH	SOLE	181894	0	0
HANNON ARMSTRONG SUST INFR C COM	COM	41068X100	978	41857	SH	OTR	41857	0	0
HANOVER INS GROUP INC COM	COM	410867105	35559	471481	SH	SOLE	471481	0	0
HARRIS CORP DEL COM	COM	413875105	31516	344023	SH	SOLE	344023	0	0
HARTFORD FINL SVCS GROUP INC COM	COM	416515104	186738	4360994	SH	SOLE	4205668	0	155326
HARTFORD FINL SVCS GROUP INC COM	COM	416515104	78	1818	SH	OTR	0	0	1818
HASBRO INC COM	COM	418056107	6084	76691	SH	SOLE	76691	0	0
HAWAIIAN HOLDINGS INC COM	COM	419879101	3524	72519	SH	SOLE	72519	0	0
HEALTHSOUTH CORP COM NEW	COM	421924309	139940	3449336	SH	SOLE	3296461	0	152875
HEALTHWAYS INC COM	COM	422245100	4985	188391	SH	SOLE	188391	0	0
HEALTHWAYS INC COM	COM	422245100	1155	43649	SH	OTR	43649	0	0
HEALTHCARE TR AMER INC CL A NEW	COM	42225P501	60788	1863524	SH	SOLE	1863524	0	0
HEALTHEQUITY INC COM	COM	42226A107	5379	142108	SH	SOLE	138511	0	3597
HEICO CORP NEW COM	COM	422806109	8807	127268	SH	SOLE	124039	0	3229
HELMERICH  PAYNE INC COM	COM	423452101	34605	514184	SH	SOLE	487252	0	26932
HEMISPHERE MEDIA GROUP INC CL A	COM	42365Q103	1586	124379	SH	SOLE	124379	0	0
HENRY JACK  ASSOC INC COM	COM	426281101	8684	101512	SH	SOLE	101512	0	0
HERBALIFE LTD NOTE 2.000% 8/1	CV	42703MAB9	10208	10298000	PRN	SOLE	10298000	0	0
HESS CORP COM	COM	42809H107	9485	176900	SH	SOLE	176900	0	0
HEWLETT PACKARD ENTERPRISE C COM	COM	42824C109	80565	3541312	SH	SOLE	3429714	0	111598
HEWLETT PACKARD ENTERPRISE C COM	COM	42824C109	92	4032	SH	OTR	0	0	4032
HEXCEL CORP NEW COM	COM	428291108	9529	215100	SH	SOLE	215100	0	0
HIGHWOODS PPTYS INC COM	COM	431284108	99566	1910316	SH	SOLE	1812376	0	97940
HOLOGIC INC DEBT 2.000% 3/0	CV	436440AC5	9188	6731000	PRN	SOLE	6731000	0	0
HOME DEPOT INC COM	COM	437076102	64091	498066	SH	SOLE	498066	0	0
HOMESTREET INC COM	COM	43785V102	4754	189688	SH	SOLE	189688	0	0
HOMESTREET INC COM	COM	43785V102	1101	43950	SH	OTR	43950	0	0
HONEYWELL INTL INC COM	COM	438516106	1201	10304	SH	SOLE	10304	0	0
HORMEL FOODS CORP COM	COM	440452100	10579	278900	SH	SOLE	278900	0	0
HOST HOTELS  RESORTS INC COM	COM	44107P104	4110	264000	SH	SOLE	264000	0	0
HUBBELL INC COM	COM	443510607	95573	887070	SH	SOLE	851461	0	35609
HUBSPOT INC COM	COM	443573100	38494	668062	SH	SOLE	650605	0	17457
HUNT J B TRANS SVCS INC COM	COM	445658107	5626	69336	SH	SOLE	69336	0	0
HUNTINGTON INGALLS INDS INC COM	COM	446413106	17022	110953	SH	SOLE	110953	0	0
HUNTSMAN CORP COM	COM	447011107	47458	2916895	SH	SOLE	2916895	0	0
ICF INTL INC COM	COM	44925C103	18236	411453	SH	SOLE	411453	0	0
ITT INC COM	COM	45073V108	70696	1972537	SH	SOLE	1937204	0	35333
ITT INC COM	COM	45073V108	70	1967	SH	OTR	0	0	1967
ICICI BK LTD ADR	ADR	45104G104	148	19872	SH	SOLE	9991	0	9881
ICICI BK LTD ADR	ADR	45104G104	6	776	SH	OTR	0	0	776
IDACORP INC COM	COM	451107106	41377	528575	SH	SOLE	528575	0	0
IDEX CORP COM	COM	45167R104	8483	90664	SH	SOLE	90664	0	0
IDEXX LABS INC COM	COM	45168D104	33724	299160	SH	SOLE	299160	0	0
ILLINOIS TOOL WKS INC COM	COM	452308109	24314	202890	SH	SOLE	202890	0	0
ILLUMINA INC COM	COM	452327109	11271	62047	SH	SOLE	62047	0	0
ILLUMINA INC NOTE 0.500% 6/1	CV	452327AH2	8277	7550000	PRN	SOLE	7550000	0	0
IMAX CORP COM	COM	45245E109	25841	892001	SH	SOLE	869036	0	22965
INCYTE CORP COM	COM	45337C102	25751	273106	SH	SOLE	273106	0	0
INCYTE CORP NOTE 0.375%11/1	CV	45337CAM4	13485	7088000	PRN	SOLE	7088000	0	0
INGEVITY CORP COM	COM	45688C107	7218	156569	SH	SOLE	146314	0	10255
INPHI CORP COM	COM	45772F107	46587	1070720	SH	SOLE	1045502	0	25218
INPHI CORP COM	COM	45772F107	909	20894	SH	OTR	20894	0	0
INSPERITY INC COM	COM	45778Q107	17958	247222	SH	SOLE	241664	0	5558
INSPERITY INC COM	COM	45778Q107	504	6933	SH	OTR	6933	0	0
INOGEN INC COM	COM	45780L104	6793	113412	SH	SOLE	113412	0	0
INOGEN INC COM	COM	45780L104	1561	26064	SH	OTR	26064	0	0
INSTRUCTURE INC COM	COM	45781U103	30675	1209095	SH	SOLE	1190369	0	18726
INSTRUCTURE INC COM	COM	45781U103	2821	111211	SH	OTR	111211	0	0
INSULET CORP COM	COM	45784P101	33439	816781	SH	SOLE	796088	0	20693
INTEGRA LIFESCIENCES HLDGS C COM NEW	COM	457985208	35273	427289	SH	SOLE	421689	0	5600
INTEL CORP COM	COM	458140100	338071	8955514	SH	SOLE	8808315	0	147199
INTEL CORP COM	COM	458140100	171	4536	SH	OTR	0	0	4536
INTEL CORP SDCV 3.250% 8/0	CV	458140AF7	44785	24464000	PRN	SOLE	24464000	0	0
INTERCONTINENTAL EXCHANGE IN COM	COM	45866F104	29350	108961	SH	SOLE	108961	0	0
INTERNATIONAL BUSINESS MACHS COM	COM	459200101	155337	977887	SH	SOLE	977887	0	0
INTERNATIONAL FLAVORSFRAGRA COM	COM	459506101	28917	202257	SH	SOLE	202257	0	0
INTL PAPER CO COM	COM	460146103	68776	1433439	SH	SOLE	1433439	0	0
INTUITIVE SURGICAL INC COM NEW	COM	46120E602	82236	113455	SH	SOLE	113455	0	0
IROBOT CORP COM	COM	462726100	33313	757463	SH	SOLE	740664	0	16799
IROBOT CORP COM	COM	462726100	1083	24626	SH	OTR	24626	0	0
ISHARES TR EAFE SML CP ETF	ETF	464288273	6215	118576	SH	SOLE	118576	0	0
ITC HLDGS CORP COM	COM	465685105	52776	1135450	SH	SOLE	1045562	0	89888
JPMORGAN CHASE  CO COM	COM	46625H100	419636	6301784	SH	SOLE	6204902	0	96882
JPMORGAN CHASE  CO COM	COM	46625H100	221	3321	SH	OTR	0	0	3321
JABIL CIRCUIT INC COM	COM	466313103	5407	247800	SH	SOLE	247800	0	0
JACOBS ENGR GROUP INC DEL COM	COM	469814107	56039	1083507	SH	SOLE	1002645	0	80862
JEFFERIES GROUP INC NEW DBCV 3.875%11/0	CV	472319AG7	4171	4099000	PRN	SOLE	4099000	0	0
JETBLUE AIRWAYS CORP COM	COM	477143101	8341	483800	SH	SOLE	483800	0	0
JOHNSON  JOHNSON COM	COM	478160104	352776	2986341	SH	SOLE	2937071	0	49270
JOHNSON  JOHNSON COM	COM	478160104	202	1710	SH	OTR	0	0	1710
JONES ENERGY INC COM CL A	COM	48019R108	1235	347000	SH	SOLE	347000	0	0
JUNIPER NETWORKS INC COM	COM	48203R104	83614	3475218	SH	SOLE	3475218	0	0
KAR AUCTION SVCS INC COM	COM	48238T109	113103	2620547	SH	SOLE	2486632	0	133915
KLA-TENCOR CORP COM	COM	482480100	16612	238300	SH	SOLE	238300	0	0
KANSAS CITY SOUTHERN COM NEW	COM	485170302	31988	342775	SH	SOLE	342775	0	0
KB HOME NOTE 1.375% 2/0	CV	48666KAS8	18959	19395000	PRN	SOLE	19395000	0	0
KELLOGG CO COM	COM	487836108	39556	510597	SH	SOLE	510597	0	0
KENNAMETAL INC COM	COM	489170100	32138	1107445	SH	SOLE	1107445	0	0
KEYCORP NEW COM	COM	493267108	1314	108000	SH	SOLE	108000	0	0
KEYCORP NEW PFD 7.75% SR A	CVPFD	493267405	3263	23899	SH	SOLE	23899	0	0
KIMBERLY CLARK CORP COM	COM	494368103	139542	1106250	SH	SOLE	1106250	0	0
KIMCO RLTY CORP COM	COM	49446R109	49287	1702502	SH	SOLE	1702502	0	0
KINDER MORGAN INC DEL COM	COM	49456B101	58850	2544300	SH	SOLE	2544300	0	0
KINDER MORGAN INC DEL PFD SER A	CVPFD	49456B200	8242	164605	SH	SOLE	164605	0	0
KOHLS CORP COM	COM	500255104	5858	133900	SH	SOLE	133900	0	0
KRAFT HEINZ CO COM	COM	500754106	53464	597301	SH	SOLE	597301	0	0
L BRANDS INC COM	COM	501797104	71875	1015620	SH	SOLE	987245	0	28375
L BRANDS INC COM	COM	501797104	68	957	SH	OTR	0	0	957
LGI HOMES INC COM	COM	50187T106	21262	577142	SH	SOLE	577142	0	0
LGI HOMES INC COM	COM	50187T106	2054	55765	SH	OTR	55765	0	0
LGI HOMES INC NOTE 4.250%11/1	CV	50187TAB2	8715	4950000	PRN	SOLE	4950000	0	0
LKQ CORP COM	COM	501889208	8885	250555	SH	SOLE	250555	0	0
LSI INDS INC COM	COM	50216C108	4056	361217	SH	SOLE	361217	0	0
LSI INDS INC COM	COM	50216C108	933	83123	SH	OTR	83123	0	0
LAM RESEARCH CORP COM	COM	512807108	62841	663506	SH	SOLE	635163	0	28343
LAM RESEARCH CORP NOTE 1.250% 5/1	CV	512807AL2	5014	3140000	PRN	SOLE	3140000	0	0
LAWSON PRODS INC COM	COM	520776105	2113	119200	SH	SOLE	119200	0	0
LEAR CORP COM NEW	COM	521865204	9176	75700	SH	SOLE	75700	0	0
LEIDOS HLDGS INC COM	COM	525327102	7609	175800	SH	SOLE	175800	0	0
LENDINGTREE INC NEW COM	COM	52603B107	30824	318071	SH	SOLE	311328	0	6743
LENDINGTREE INC NEW COM	COM	52603B107	1266	13068	SH	OTR	13068	0	0
LENNAR CORP CL A	COM	526057104	118557	2800121	SH	SOLE	2691554	0	108567
LENNAR CORP CL A	COM	526057104	46	1078	SH	OTR	0	0	1078
LENNOX INTL INC COM	COM	526107107	4757	30296	SH	SOLE	30296	0	0
LINCOLN NATL CORP IND COM	COM	534187109	56681	1206500	SH	SOLE	1206500	0	0
LITTELFUSE INC COM	COM	537008104	41873	325073	SH	SOLE	325073	0	0
LIVE NATION ENTERTAINMENT IN COM	COM	538034109	35916	1306992	SH	SOLE	1274032	0	32960
LIVE NATION ENTERTAINMENT IN DBCV 2.500% 5/1	CV	538034AJ8	13602	12500000	PRN	SOLE	12500000	0	0
LLOYDS BANKING GROUP PLC SPONSORED ADR	ADR	539439109	84	29319	SH	SOLE	14601	0	14718
LLOYDS BANKING GROUP PLC SPONSORED ADR	ADR	539439109	4	1236	SH	OTR	0	0	1236
LLOYDS BANKING GROUP PLC SDCV 7.500%12/3	CV	539439AG4	10473	10117000	PRN	SOLE	10117000	0	0
LOCKHEED MARTIN CORP COM	COM	539830109	110280	460036	SH	SOLE	460036	0	0
LOUISIANA PAC CORP COM	COM	546347105	16201	860368	SH	SOLE	860368	0	0
LOWES COS INC COM	COM	548661107	37361	517400	SH	SOLE	517400	0	0
LYDALL INC DEL COM	COM	550819106	2276	44507	SH	SOLE	44507	0	0
M  T BK CORP COM	COM	55261F104	71107	612467	SH	SOLE	612467	0	0
MB FINANCIAL INC NEW COM	COM	55264U108	24038	631916	SH	SOLE	631916	0	0
MGIC INVT CORP WIS NOTE 2.000% 4/0	CV	552848AE3	12006	9477000	PRN	SOLE	9477000	0	0
MGM RESORTS INTERNATIONAL COM	COM	552953101	36985	1420853	SH	SOLE	1420853	0	0
MGP INGREDIENTS INC NEW COM	COM	55303J106	3347	82594	SH	SOLE	82594	0	0
MGP INGREDIENTS INC NEW COM	COM	55303J106	764	18856	SH	OTR	18856	0	0
M/I HOMES INC COM	COM	55305B101	1650	70000	SH	SOLE	70000	0	0
MKS INSTRUMENT INC COM	COM	55306N104	5371	108000	SH	SOLE	108000	0	0
MRC GLOBAL INC COM	COM	55345K103	11613	706840	SH	SOLE	706840	0	0
MSC INDL DIRECT INC CL A	COM	553530106	50608	689391	SH	SOLE	658198	0	31193
MSCI INC COM	COM	55354G100	38958	464114	SH	SOLE	464114	0	0
MACOM TECH SOLUTIONS HLDGS I COM	COM	55405Y100	51812	1223715	SH	SOLE	1149455	0	74260
MADDEN STEVEN LTD COM	COM	556269108	73781	2134876	SH	SOLE	2002843	0	132033
MARATHON OIL CORP COM	COM	565849106	41834	2646027	SH	SOLE	2620527	0	25500
MARCUS  MILLICHAP INC COM	COM	566324109	12282	469663	SH	SOLE	469663	0	0
MARKEL CORP COM	COM	570535104	40297	43387	SH	SOLE	40125	0	3262
MARKETAXESS HLDGS INC COM	COM	57060D108	90358	545673	SH	SOLE	539482	0	6191
MARSH  MCLENNAN COS INC COM	COM	571748102	69967	1040400	SH	SOLE	1040400	0	0
MARRIOTT INTL INC NEW CL A	COM	571903202	15589	231537	SH	SOLE	231537	0	0
MARTIN MARIETTA MATLS INC COM	COM	573284106	10581	59073	SH	SOLE	59073	0	0
MASCO CORP COM	COM	574599106	4007	116800	SH	SOLE	116800	0	0
MASIMO CORP COM	COM	574795100	18581	312334	SH	SOLE	304321	0	8013
MASTERCARD INCORPORATED CL A	COM	57636Q104	12167	119554	SH	SOLE	119554	0	0
MATCH GROUP INC COM	COM	57665R106	29459	1655908	SH	SOLE	1613190	0	42718
MATERIALISE NV SPONSORED ADS	ADR	57667T100	10438	1355523	SH	SOLE	1327376	0	28147
MATERIALISE NV SPONSORED ADS	ADR	57667T100	702	91137	SH	OTR	91137	0	0
MATTEL INC COM	COM	577081102	34280	1132100	SH	SOLE	1132100	0	0
MAXLINEAR INC CL A	COM	57776J100	28122	1387392	SH	SOLE	1360880	0	26512
MAXLINEAR INC CL A	COM	57776J100	911	44937	SH	OTR	44937	0	0
MAXIMUS INC COM	COM	577933104	58091	1027068	SH	SOLE	974355	0	52713
MCCORMICK  CO INC COM NON VTG	COM	579780206	8959	89659	SH	SOLE	89659	0	0
MCDONALDS CORP COM	COM	580135101	126734	1098600	SH	SOLE	1098600	0	0
MEAD JOHNSON NUTRITION CO COM	COM	582839106	4870	61644	SH	SOLE	61644	0	0
MEDIDATA SOLUTIONS INC COM	COM	58471A105	8787	157582	SH	SOLE	153584	0	3998
MEDIDATA SOLUTIONS INC NOTE 1.000% 8/0	CV	58471AAB1	22502	19181000	PRN	SOLE	19181000	0	0
MERCADOLIBRE INC COM	COM	58733R102	34306	185470	SH	SOLE	185470	0	0
MERCADOLIBRE INC NOTE 2.250% 7/0	CV	58733RAB8	23646	15115000	PRN	SOLE	15115000	0	0
MERCK  CO INC COM	COM	58933Y105	74174	1188500	SH	SOLE	1188500	0	0
MERCURY SYS INC COM	COM	589378108	4493	182872	SH	SOLE	182872	0	0
MERCURY SYS INC COM	COM	589378108	1042	42392	SH	OTR	42392	0	0
METLIFE INC COM	COM	59156R108	69395	1561900	SH	SOLE	1561900	0	0
METTLER TOLEDO INTERNATIONAL COM	COM	592688105	10606	25262	SH	SOLE	25262	0	0
MICHAELS COS INC COM	COM	59408Q106	7754	320798	SH	SOLE	320798	0	0
MICROSOFT CORP COM	COM	594918104	200530	3481426	SH	SOLE	3451868	0	29558
MICROSOFT CORP COM	COM	594918104	67	1168	SH	OTR	0	0	1168
MICROCHIP TECHNOLOGY INC COM	COM	595017104	116928	1881681	SH	SOLE	1848196	0	33485
MICROCHIP TECHNOLOGY INC COM	COM	595017104	88	1421	SH	OTR	0	0	1421
MICROCHIP TECHNOLOGY INC SDCV 2.125%12/1	CV	595017AB0	3499	1350000	PRN	SOLE	1350000	0	0
MICROCHIP TECHNOLOGY INC NOTE 1.625% 2/1	CV	595017AD6	35648	27850000	PRN	SOLE	27850000	0	0
MICRON TECHNOLOGY INC COM	COM	595112103	14546	818100	SH	SOLE	818100	0	0
MICRON TECHNOLOGY INC NOTE 2.125% 2/1	CV	595112AV5	9378	5300000	PRN	SOLE	5300000	0	0
MICRON TECHNOLOGY INC NOTE 3.000%11/1	CV	595112AY9	13064	14617000	PRN	SOLE	14617000	0	0
MID-AMER APT CMNTYS INC COM	COM	59522J103	7294	77600	SH	SOLE	77600	0	0
MIDDLEBY CORP COM	COM	596278101	41688	337223	SH	SOLE	337223	0	0
MILACRON HLDGS CORP COM	COM	59870L106	20296	1271687	SH	SOLE	1271687	0	0
MILLER HERMAN INC COM	COM	600544100	45646	1596006	SH	SOLE	1478258	0	117748
MINERALS TECHNOLOGIES INC COM	COM	603158106	43840	620174	SH	SOLE	611641	0	8533
MOELIS  CO CL A	COM	60786M105	31279	1163230	SH	SOLE	1081516	0	81714
MOHAWK INDS INC COM	COM	608190104	6681	33350	SH	SOLE	33350	0	0
MOLSON COORS BREWING CO CL B	COM	60871R209	56377	513453	SH	SOLE	513453	0	0
MONDELEZ INTL INC CL A	COM	609207105	127387	2901756	SH	SOLE	2809863	0	91893
MONDELEZ INTL INC CL A	COM	609207105	167	3805	SH	OTR	0	0	3805
MONOLITHIC PWR SYS INC COM	COM	609839105	34937	434005	SH	SOLE	421727	0	12278
MONSANTO CO NEW COM	COM	61166W101	29489	288544	SH	SOLE	288544	0	0
MOODYS CORP COM	COM	615369105	9930	91709	SH	SOLE	91709	0	0
MORGAN STANLEY COM NEW	COM	617446448	3827	119363	SH	SOLE	107310	0	12053
MORGAN STANLEY COM NEW	COM	617446448	61	1889	SH	OTR	0	0	1889
MOTOROLA SOLUTIONS INC COM NEW	COM	620076307	64054	839723	SH	SOLE	839723	0	0
MURPHY OIL CORP COM	COM	626717102	3456	113700	SH	SOLE	113700	0	0
MURPHY USA INC COM	COM	626755102	3126	43800	SH	SOLE	43800	0	0
NV5 GLOBAL INC COM	COM	62945V109	8792	272127	SH	SOLE	272127	0	0
NV5 GLOBAL INC COM	COM	62945V109	2040	63136	SH	OTR	63136	0	0
NXP SEMICONDUCTORS N V DBCV 1.000%12/0	CV	62952QAB6	1557	1300000	PRN	SOLE	1300000	0	0
NANOSTRING TECHNOLOGIES INC COM	COM	63009R109	7493	375034	SH	SOLE	375034	0	0
NANOSTRING TECHNOLOGIES INC COM	COM	63009R109	1737	86937	SH	OTR	86937	0	0
NATERA INC COM	COM	632307104	4529	407649	SH	SOLE	407649	0	0
NATERA INC COM	COM	632307104	1051	94644	SH	OTR	94644	0	0
NATIONAL COMM CORP COM	COM	63546L102	4552	168236	SH	SOLE	168236	0	0
NATIONAL OILWELL VARCO INC COM	COM	637071101	7679	209000	SH	SOLE	209000	0	0
NATIONAL STORAGE AFFILIATES COM SHS BEN IN	COM	637870106	1830	87413	SH	SOLE	87413	0	0
NATIONAL STORAGE AFFILIATES COM SHS BEN IN	COM	637870106	421	20115	SH	OTR	20115	0	0
NAVIENT CORP COM	COM	63938C108	21462	1483200	SH	SOLE	1483200	0	0
NEENAH PAPER INC COM	COM	640079109	11078	140204	SH	SOLE	140204	0	0
NETAPP INC COM	COM	64110D104	2737	76400	SH	SOLE	76400	0	0
NETEASE INC SPONSORED ADR	ADR	64110W102	40502	168213	SH	SOLE	168213	0	0
NEUROCRINE BIOSCIENCES INC COM	COM	64125C109	17509	345748	SH	SOLE	336595	0	9153
NEVRO CORP COM	COM	64157F103	77688	744214	SH	SOLE	728451	0	15763
NEVRO CORP NOTE 1.750% 6/0	CV	64157FAA1	22012	16843000	PRN	SOLE	16843000	0	0
NEW JERSEY RES COM	COM	646025106	5219	158822	SH	SOLE	154813	0	4009
NEW ORIENTAL ED  TECH GRP I SPON ADR	ADR	647581107	16690	360004	SH	SOLE	360004	0	0
NEW YORK TIMES CO CL A	COM	650111107	47539	3978175	SH	SOLE	3685873	0	292302
NEWELL BRANDS INC COM	COM	651229106	96318	1829048	SH	SOLE	1744559	0	84489
NEWMONT MINING CORP COM	COM	651639106	39535	1006226	SH	SOLE	1006226	0	0
NEXTERA ENERGY INC COM	COM	65339F101	125388	1025078	SH	SOLE	997648	0	27430
NEXTERA ENERGY INC COM	COM	65339F101	124	1010	SH	OTR	0	0	1010
NEXTERA ENERGY INC UNIT 09/01/2019	CVPFD	65339F820	16685	335032	SH	SOLE	335032	0	0
NEXTERA ENERGY INC UNIT 08/31/2018	CVPFD	65339F846	4470	75711	SH	SOLE	75711	0	0
NIKE INC CL B	COM	654106103	24735	469800	SH	SOLE	469800	0	0
NOBLE ENERGY INC COM	COM	655044105	57285	1602818	SH	SOLE	1602818	0	0
NORDSON CORP COM	COM	655663102	78100	783902	SH	SOLE	773302	0	10600
NORDSTROM INC COM	COM	655664100	34067	656646	SH	SOLE	607536	0	49110
NORFOLK SOUTHERN CORP COM	COM	655844108	45492	468700	SH	SOLE	468700	0	0
NORTHROP GRUMMAN CORP COM	COM	666807102	36652	171311	SH	SOLE	171311	0	0
NOVELLUS SYS INC NOTE 2.625% 5/1	CV	670008AD3	15089	5407000	PRN	SOLE	5407000	0	0
NOW INC COM	COM	67011P100	6065	283000	SH	SOLE	283000	0	0
NUTANIX INC CL A	COM	67059N108	26085	705000	SH	SOLE	697106	0	7894
NVIDIA CORP COM	COM	67066G104	68761	1003524	SH	SOLE	1003524	0	0
NVIDIA CORP NOTE 1.000%12/0	CV	67066GAC8	51797	15201000	PRN	SOLE	15201000	0	0
NUVASIVE INC COM	COM	670704105	2949	44246	SH	SOLE	44246	0	0
NUVASIVE INC NOTE 2.750% 7/0	CV	670704AC9	6951	4309000	PRN	SOLE	4309000	0	0
NXSTAGE MEDICAL INC COM	COM	67072V103	2391	95660	SH	SOLE	95660	0	0
NXSTAGE MEDICAL INC COM	COM	67072V103	554	22164	SH	OTR	22164	0	0
O REILLY AUTOMOTIVE INC NEW COM	COM	67103H107	11369	40587	SH	SOLE	40587	0	0
OASIS PETE INC NEW NOTE 2.625% 9/1	CV	674215AJ7	9915	8750000	PRN	SOLE	8750000	0	0
OCCIDENTAL PETE CORP DEL COM	COM	674599105	207866	2850601	SH	SOLE	2788417	0	62184
OCCIDENTAL PETE CORP DEL COM	COM	674599105	153	2103	SH	OTR	0	0	2103
OCLARO INC COM NEW	COM	67555N206	3863	451827	SH	SOLE	451827	0	0
OCLARO INC COM NEW	COM	67555N206	896	104738	SH	OTR	104738	0	0
OLD DOMINION FGHT LINES INC COM	COM	679580100	43331	631552	SH	SOLE	585085	0	46467
OLD REP INTL CORP COM	COM	680223104	8886	504300	SH	SOLE	504300	0	0
OLLIES BARGAIN OUTLT HLDGS I COM	COM	681116109	21617	824750	SH	SOLE	803217	0	21533
OMNICOM GROUP INC COM	COM	681919106	37052	435900	SH	SOLE	435900	0	0
ON SEMICONDUCTOR CORP COM	COM	682189105	40335	3273952	SH	SOLE	3273952	0	0
ON SEMICONDUCTOR CORP NOTE 1.000%12/0	CV	682189AK1	30910	30341000	PRN	SOLE	30341000	0	0
ONE GAS INC COM	COM	68235P108	5226	84506	SH	SOLE	82369	0	2137
ONEOK INC NEW COM	COM	682680103	21255	413600	SH	SOLE	413600	0	0
ORBITAL ATK INC COM	COM	68557N103	41658	546473	SH	SOLE	546473	0	0
PBF ENERGY INC CL A	COM	69318G106	1628	71900	SH	SOLE	71900	0	0
PDC ENERGY INC NOTE 1.125% 9/1	CV	69327RAD3	15419	14444000	PRN	SOLE	14444000	0	0
PGE CORP COM	COM	69331C108	32777	535831	SH	SOLE	535831	0	0
PPG INDS INC COM	COM	693506107	30678	296812	SH	SOLE	296812	0	0
PPL CORP COM	COM	69351T106	102868	2975642	SH	SOLE	2975642	0	0
PVH CORP COM	COM	693656100	33920	306970	SH	SOLE	306970	0	0
PACIFIC BIOSCIENCES CALIF IN COM	COM	69404D108	55026	6141264	SH	SOLE	6024754	0	116510
PACIFIC BIOSCIENCES CALIF IN COM	COM	69404D108	2268	253100	SH	OTR	253100	0	0
PACIFIC PREMIER BANCORP COM	COM	69478X105	5315	200880	SH	SOLE	200880	0	0
PACIFIC PREMIER BANCORP COM	COM	69478X105	495	18723	SH	OTR	18723	0	0
PACKAGING CORP AMER COM	COM	695156109	10700	131679	SH	SOLE	131679	0	0
PALO ALTO NETWORKS INC COM	COM	697435105	9398	58986	SH	SOLE	58986	0	0
PALO ALTO NETWORKS INC NOTE 7/0	CV	697435AB1	9161	5990000	PRN	SOLE	5990000	0	0
PANERA BREAD CO CL A	COM	69840W108	25338	130124	SH	SOLE	127783	0	2341
PARSLEY ENERGY INC CL A	COM	701877102	30017	895752	SH	SOLE	895752	0	0
PATRICK INDS INC COM	COM	703343103	25479	411488	SH	SOLE	411488	0	0
PATRICK INDS INC COM	COM	703343103	2407	38876	SH	OTR	38876	0	0
PATTERSON UTI ENERGY INC COM	COM	703481101	53985	2413298	SH	SOLE	2413298	0	0
PAYCOM SOFTWARE INC COM	COM	70432V102	83112	1657930	SH	SOLE	1625376	0	32554
PAYLOCITY HLDG CORP COM	COM	70438V106	66795	1502367	SH	SOLE	1472274	0	30093
PAYPAL HLDGS INC COM	COM	70450Y103	17478	426607	SH	SOLE	426607	0	0
PENSKE AUTOMOTIVE GRP INC COM	COM	70959W103	3233	67100	SH	SOLE	67100	0	0
PENUMBRA INC COM	COM	70975L107	74641	982244	SH	SOLE	962663	0	19581
PEPSICO INC COM	COM	713448108	212193	1950840	SH	SOLE	1912222	0	38618
PEPSICO INC COM	COM	713448108	152	1401	SH	OTR	0	0	1401
PERFICIENT INC COM	COM	71375U101	2596	128843	SH	SOLE	128843	0	0
PERFICIENT INC COM	COM	71375U101	600	29785	SH	OTR	29785	0	0
PERFORMANCE FOOD GROUP CO COM	COM	71377A103	36824	1484823	SH	SOLE	1444798	0	40025
PERKINELMER INC COM	COM	714046109	81553	1453449	SH	SOLE	1375781	0	77668
PETMED EXPRESS INC COM	COM	716382106	2167	106831	SH	SOLE	106831	0	0
PETMED EXPRESS INC COM	COM	716382106	503	24803	SH	OTR	24803	0	0
PFIZER INC COM	COM	717081103	407652	12035773	SH	SOLE	11863477	0	172296
PFIZER INC COM	COM	717081103	201	5922	SH	OTR	0	0	5922
PHYSICIANS RLTY TR COM	COM	71943U104	94866	4404166	SH	SOLE	4151247	0	252919
PILGRIMS PRIDE CORP NEW COM	COM	72147K108	3641	172400	SH	SOLE	172400	0	0
PINNACLE WEST CAP CORP COM	COM	723484101	10031	132000	SH	SOLE	132000	0	0
PINNACLE FOODS INC DEL COM	COM	72348P104	119766	2387207	SH	SOLE	2271078	0	116129
PIONEER NAT RES CO COM	COM	723787107	9932	53500	SH	SOLE	53500	0	0
PITNEY BOWES INC COM	COM	724479100	20706	1140200	SH	SOLE	1140200	0	0
PLANET FITNESS INC CL A	COM	72703H101	43790	2181862	SH	SOLE	2126317	0	55545
PLANTRONICS INC NEW COM	COM	727493108	16554	318589	SH	SOLE	318589	0	0
POLYONE CORP COM	COM	73179P106	15206	449737	SH	SOLE	449737	0	0
POOL CORPORATION COM	COM	73278L105	45987	486536	SH	SOLE	477342	0	9194
PORTLAND GEN ELEC CO COM NEW	COM	736508847	72184	1694859	SH	SOLE	1690515	0	4344
POTLATCH CORP NEW COM	COM	737630103	11681	300350	SH	SOLE	300350	0	0
PRESTIGE BRANDS HLDGS INC COM	COM	74112D101	29687	615029	SH	SOLE	571502	0	43527
PRICE T ROWE GROUP INC COM	COM	74144T108	19584	294500	SH	SOLE	294500	0	0
PRICELINE GRP INC COM NEW	COM	741503403	22367	15200	SH	SOLE	15200	0	0
PRICELINE GRP INC NOTE 1.000% 3/1	CV	741503AQ9	5906	3720000	PRN	SOLE	3720000	0	0
PRICELINE GRP INC NOTE 0.350% 6/1	CV	741503AS5	19720	15346000	PRN	SOLE	15346000	0	0
PRIMORIS SVCS CORP COM	COM	74164F103	18272	886972	SH	SOLE	886972	0	0
PRINCIPAL FINL GROUP INC COM	COM	74251V102	3874	75200	SH	SOLE	75200	0	0
PROCTER AND GAMBLE CO COM	COM	742718109	130864	1458100	SH	SOLE	1458100	0	0
PROLOGIS INC COM	COM	74340W103	66352	1239300	SH	SOLE	1239300	0	0
PROOFPOINT INC COM	COM	743424103	58516	781777	SH	SOLE	765211	0	16566
PROOFPOINT INC NOTE 1.250%12/1	CV	743424AB9	15718	8123000	PRN	SOLE	8123000	0	0
PROOFPOINT INC DBCV 0.750% 6/1	CV	743424AD5	3534	3043000	PRN	SOLE	3043000	0	0
PRUDENTIAL FINL INC COM	COM	744320102	107427	1315700	SH	SOLE	1315700	0	0
PUBLIC SVC ENTERPRISE GROUP COM	COM	744573106	11116	265500	SH	SOLE	265500	0	0
QUAKER CHEM CORP COM	COM	747316107	2733	25800	SH	SOLE	25800	0	0
QTS RLTY TR INC COM CL A	COM	74736A103	9775	184956	SH	SOLE	184956	0	0
QUALCOMM INC COM	COM	747525103	365231	5331834	SH	SOLE	5270712	0	61122
QUALCOMM INC COM	COM	747525103	148	2162	SH	OTR	0	0	2162
QUEST DIAGNOSTICS INC COM	COM	74834L100	26091	308300	SH	SOLE	308300	0	0
RPC INC COM	COM	749660106	1294	77000	SH	SOLE	77000	0	0
RPM INTL INC COM	COM	749685103	56240	1046905	SH	SOLE	998835	0	48070
RPM INTL INC NOTE 2.250%12/1	CV	749685AT0	5468	4545000	PRN	SOLE	4545000	0	0
RTI INTL METALS INC NOTE 1.625%10/1	CV	74973WAB3	13303	12418000	PRN	SOLE	12418000	0	0
RALPH LAUREN CORP CL A	COM	751212101	30247	299056	SH	SOLE	276718	0	22338
RANGE RES CORP COM	COM	75281A109	35839	924869	SH	SOLE	924869	0	0
RAYTHEON CO COM NEW	COM	755111507	103322	758996	SH	SOLE	758996	0	0
RBC BEARINGS INC COM	COM	75524B104	1492	19507	SH	SOLE	19032	0	475
RE MAX HLDGS INC CL A	COM	75524W108	4216	96294	SH	SOLE	96294	0	0
REALOGY HLDGS CORP COM	COM	75605Y106	26011	1005820	SH	SOLE	940694	0	65126
REALTY INCOME CORP COM	COM	756109104	3869	57800	SH	SOLE	57800	0	0
RED HAT INC COM	COM	756577102	11678	144479	SH	SOLE	144479	0	0
RED HAT INC NOTE 0.250%10/0	CV	756577AD4	3050	2400000	PRN	SOLE	2400000	0	0
REGENCY CTRS CORP COM	COM	758849103	19132	246900	SH	SOLE	246900	0	0
REGENERON PHARMACEUTICALS COM	COM	75886F107	5828	14497	SH	SOLE	14497	0	0
REINSURANCE GROUP AMER INC COM NEW	COM	759351604	23110	214098	SH	SOLE	214098	0	0
RELIANCE STEEL  ALUMINUM CO COM	COM	759509102	96256	1336337	SH	SOLE	1254841	0	81496
RENASANT CORP COM	COM	75970E107	18857	560709	SH	SOLE	560709	0	0
REPLIGEN CORP COM	COM	759916109	4976	164832	SH	SOLE	164832	0	0
REPLIGEN CORP COM	COM	759916109	1157	38333	SH	OTR	38333	0	0
REPLIGEN CORP NOTE 2.125% 6/0	CV	759916AA7	3487	3050000	PRN	SOLE	3050000	0	0
REPUBLIC SVCS INC COM	COM	760759100	12951	256700	SH	SOLE	256700	0	0
