nameOfIssuer	titleOfClass	cusip	value	sshPrnamt	sshPrnamtType	investmentDiscretion	Sole	Shared	None
RETAIL OPPORTUNITY INVTS COR COM	COM	76131N101	83230	3790055	SH	SOLE	3593679	0	196376
REYNOLDS AMERICAN INC COM	COM	761713106	141756	3006500	SH	SOLE	3006500	0	0
RICE ENERGY INC COM	COM	762760106	100070	3832620	SH	SOLE	3639564	0	193056
RIO TINTO PLC SPONSORED ADR	ADR	767204100	28754	860904	SH	SOLE	857832	0	3072
RIO TINTO PLC SPONSORED ADR	ADR	767204100	9	271	SH	OTR	0	0	271
ROBERT HALF INTL INC COM	COM	770323103	14716	388700	SH	SOLE	388700	0	0
ROCKWELL AUTOMATION INC COM	COM	773903109	8032	65651	SH	SOLE	65651	0	0
ROPER TECHNOLOGIES INC COM	COM	776696106	4872	26698	SH	SOLE	26698	0	0
ROSS STORES INC COM	COM	778296103	12590	195800	SH	SOLE	195800	0	0
ROYAL BK SCOTLAND GROUP PLC NOTE 8.625%12/3	CV	780097BB6	19625	20000000	PRN	SOLE	19795000	0	205000
ROYAL BK OF SCOTLAND PLC DEBT 7.500%12/3	CV	780099CJ4	27203	29569000	PRN	SOLE	29369000	0	200000
ROYAL DUTCH SHELL PLC SPONS ADR A	ADR	780259206	22371	446791	SH	SOLE	445154	0	1637
ROYAL DUTCH SHELL PLC SPONS ADR A	ADR	780259206	7	145	SH	OTR	0	0	145
ROYAL GOLD INC NOTE 2.875% 6/1	CV	780287AA6	21244	18936000	PRN	SOLE	18936000	0	0
RUSH ENTERPRISES INC CL A	COM	781846209	1777	72600	SH	SOLE	72600	0	0
RYDER SYS INC COM	COM	783549108	4630	70200	SH	SOLE	70200	0	0
SP GLOBAL INC COM	COM	78409V104	22486	177670	SH	SOLE	177670	0	0
SEI INVESTMENTS CO COM	COM	784117103	13450	294900	SH	SOLE	294900	0	0
SL GREEN RLTY CORP COM	COM	78440X101	20561	190200	SH	SOLE	190200	0	0
SM ENERGY CO NOTE 1.500% 7/0	CV	78454LAM2	13737	11400000	PRN	SOLE	11400000	0	0
SVB FINL GROUP COM	COM	78486Q101	13011	117700	SH	SOLE	117700	0	0
SABRE CORP COM	COM	78573M104	9431	334668	SH	SOLE	334668	0	0
SAGE THERAPEUTICS INC COM	COM	78667J108	30357	659218	SH	SOLE	643764	0	15454
SAGE THERAPEUTICS INC COM	COM	78667J108	913	19830	SH	OTR	19830	0	0
SALESFORCE COM INC NOTE 0.250% 4/0	CV	79466LAD6	10523	8783000	PRN	SOLE	8783000	0	0
SAREPTA THERAPEUTICS INC COM	COM	803607100	18550	302070	SH	SOLE	294399	0	7671
SCANA CORP NEW COM	COM	80589M102	65762	908695	SH	SOLE	908695	0	0
SCHEIN HENRY INC COM	COM	806407102	6380	39145	SH	SOLE	39145	0	0
SCHLUMBERGER LTD COM	COM	806857108	61054	776370	SH	SOLE	776370	0	0
SCHWAB CHARLES CORP NEW COM	COM	808513105	2065	65400	SH	SOLE	65400	0	0
SCOTTS MIRACLE GRO CO CL A	COM	810186106	13989	168000	SH	SOLE	168000	0	0
SEALED AIR CORP NEW COM	COM	81211K100	51744	1129279	SH	SOLE	1047197	0	82082
SEATTLE GENETICS INC COM	COM	812578102	18589	344174	SH	SOLE	344174	0	0
SEMPRA ENERGY COM	COM	816851109	124488	1161380	SH	SOLE	1158802	0	2578
SEMPRA ENERGY COM	COM	816851109	30	283	SH	OTR	0	0	283
SERVICENOW INC COM	COM	81762P102	15226	192375	SH	SOLE	192375	0	0
SHAKE SHACK INC CL A	COM	819047101	23342	673253	SH	SOLE	665986	0	7267
SHOPIFY INC CL A	COM	82509L107	71467	1665122	SH	SOLE	1636019	0	29103
SHUTTERSTOCK INC COM	COM	825690100	52047	817065	SH	SOLE	801521	0	15544
SIGNATURE BK NEW YORK N Y COM	COM	82669G104	2109	17809	SH	SOLE	16347	0	1462
SIGNATURE BK NEW YORK N Y COM	COM	82669G104	28	235	SH	OTR	0	0	235
SILICON MOTION TECHNOLOGY CO SPONSORED ADR	ADR	82706C108	54583	1053933	SH	SOLE	1035999	0	17934
SILVER RUN ACQUISITION CORP UNIT 99/99/9999T	COM	82811P200	23250	1290924	SH	SOLE	1290924	0	0
SILVER SPRING NETWORKS INC COM	COM	82817Q103	4046	285357	SH	SOLE	285357	0	0
SILVER SPRING NETWORKS INC COM	COM	82817Q103	934	65872	SH	OTR	65872	0	0
SILVER WHEATON CORP COM	COM	828336107	10131	374823	SH	SOLE	374823	0	0
SIMON PPTY GROUP INC NEW COM	COM	828806109	3514	16977	SH	SOLE	16977	0	0
SIMPSON MANUFACTURING CO INC COM	COM	829073105	6065	138000	SH	SOLE	138000	0	0
SITEONE LANDSCAPE SUPPLY INC COM	COM	82982L103	12111	337084	SH	SOLE	335266	0	1818
SKYWORKS SOLUTIONS INC COM	COM	83088M102	37471	492132	SH	SOLE	492132	0	0
SMITH A O COM	COM	831865209	44825	453738	SH	SOLE	453738	0	0
SMUCKER J M CO COM NEW	COM	832696405	4405	32500	SH	SOLE	32500	0	0
SNYDERS-LANCE INC COM	COM	833551104	26353	784789	SH	SOLE	784789	0	0
SOUTH ST CORP COM	COM	840441109	15688	209068	SH	SOLE	209068	0	0
SOUTHWESTERN ENERGY CO DEP SHS 1/20 B	CVPFD	845467208	30348	961302	SH	SOLE	961302	0	0
SPARK THERAPEUTICS INC COM	COM	84652J103	64568	1075059	SH	SOLE	1057771	0	17288
SPARK THERAPEUTICS INC COM	COM	84652J103	508	8458	SH	OTR	8458	0	0
SPECTRANETICS CORP COM	COM	84760C107	8009	319214	SH	SOLE	319214	0	0
SPECTRANETICS CORP COM	COM	84760C107	1859	74076	SH	OTR	74076	0	0
SPLUNK INC COM	COM	848637104	8552	145742	SH	SOLE	145742	0	0
STAMPS COM INC COM NEW	COM	852857200	18728	198161	SH	SOLE	193039	0	5122
STANLEY BLACK  DECKER INC COM	COM	854502101	7453	60600	SH	SOLE	60600	0	0
STANLEY BLACK  DECKER INC UNIT 11/17/20166	CVPFD	854502804	5337	42246	SH	SOLE	42246	0	0
STARWOOD PPTY TR INC COM	COM	85571B105	3398	150900	SH	SOLE	150900	0	0
STARWOOD PPTY TR INC NOTE 3.750%10/1	CV	85571BAC9	5054	4889000	PRN	SOLE	4889000	0	0
STEEL DYNAMICS INC COM	COM	858119100	57836	2314377	SH	SOLE	2314377	0	0
STERICYCLE INC COM	COM	858912108	6662	83134	SH	SOLE	83134	0	0
STILLWATER MNG CO NOTE 1.750%10/1	CV	86074QAL6	10085	8369000	PRN	SOLE	8369000	0	0
STONERIDGE INC COM	COM	86183P102	3991	216918	SH	SOLE	216918	0	0
STONERIDGE INC COM	COM	86183P102	914	49687	SH	OTR	49687	0	0
SUMITOMO MITSUI FINL GROUP I SPONSORED ADR	ADR	86562M209	143	21239	SH	SOLE	10787	0	10452
SUMITOMO MITSUI FINL GROUP I SPONSORED ADR	ADR	86562M209	6	918	SH	OTR	0	0	918
SUNPOWER CORP DBCV 0.750% 6/0	CV	867652AG4	8764	9565000	PRN	SOLE	9565000	0	0
SUPERIOR ENERGY SVCS INC COM	COM	868157108	41299	2307230	SH	SOLE	2307230	0	0
SURGICAL CARE AFFILIATES INC COM	COM	86881L106	3414	70010	SH	SOLE	70010	0	0
SYNAPTICS INC COM	COM	87157D109	60483	1032480	SH	SOLE	979483	0	52997
SYSCO CORP COM	COM	871829107	41659	850000	SH	SOLE	850000	0	0
TD AMERITRADE HLDG CORP COM	COM	87236Y108	135073	3832951	SH	SOLE	3751185	0	81766
TD AMERITRADE HLDG CORP COM	COM	87236Y108	87	2481	SH	OTR	0	0	2481
TJX COS INC NEW COM	COM	872540109	26208	350473	SH	SOLE	350473	0	0
T MOBILE US INC COM	COM	872590104	10557	225961	SH	SOLE	225961	0	0
T MOBILE US INC CONV PFD SER A	CVPFD	872590203	16143	206771	SH	SOLE	206771	0	0
TPI COMPOSITES INC COM	COM	87266J104	1225	57606	SH	SOLE	57606	0	0
TPI COMPOSITES INC COM	COM	87266J104	285	13388	SH	OTR	13388	0	0
TAKE-TWO INTERACTIVE SOFTWAR NOTE 1.000% 7/0	CV	874054AD1	23399	11129000	PRN	SOLE	11129000	0	0
TALEND S A ADS	ADR	874224207	5828	222798	SH	SOLE	222798	0	0
TALEND S A ADS	ADR	874224207	874	33413	SH	OTR	33413	0	0
TARGET CORP COM	COM	87612E106	66808	972747	SH	SOLE	972747	0	0
TASER INTL INC COM	COM	87651B104	43754	1529331	SH	SOLE	1492667	0	36664
TASER INTL INC COM	COM	87651B104	506	17695	SH	OTR	17695	0	0
TECK RESOURCES LTD CL B	COM	878742204	10091	559689	SH	SOLE	559689	0	0
TEGNA INC COM	COM	87901J105	6938	317400	SH	SOLE	317400	0	0
TELEDYNE TECHNOLOGIES INC COM	COM	879360105	15147	140339	SH	SOLE	140339	0	0
TESARO INC COM	COM	881569107	83808	836070	SH	SOLE	821906	0	14164
TESARO INC NOTE 3.000%10/0	CV	881569AA5	7049	2396000	PRN	SOLE	2396000	0	0
TESORO CORP COM	COM	881609101	6134	77100	SH	SOLE	77100	0	0
TESLA MTRS INC NOTE 0.250% 3/0	CV	88160RAB7	44966	49345000	PRN	SOLE	49345000	0	0
TEVA PHARMACEUTICAL INDS LTD ADR	ADR	881624209	2238	48648	SH	SOLE	47342	0	1306
TEVA PHARMACEUTICAL INDS LTD ADR	ADR	881624209	5	109	SH	OTR	0	0	109
TEXAS CAPITAL BANCSHARES INC COM	COM	88224Q107	11602	211250	SH	SOLE	211250	0	0
TEXAS INSTRS INC COM	COM	882508104	38101	542900	SH	SOLE	542900	0	0
THE TRADE DESK INC COM CL A	COM	88339J105	3601	123284	SH	SOLE	121365	0	1919
THE TRADE DESK INC COM CL A	COM	88339J105	350	11977	SH	OTR	11977	0	0
THERMO FISHER SCIENTIFIC INC COM	COM	883556102	56281	353835	SH	SOLE	341403	0	12432
THERMO FISHER SCIENTIFIC INC COM	COM	883556102	54	337	SH	OTR	0	0	337
THOR INDS INC COM	COM	885160101	73168	863852	SH	SOLE	828351	0	35501
3M CO COM	COM	88579Y101	68379	388009	SH	SOLE	388009	0	0
TIFFANY  CO NEW COM	COM	886547108	4757	65500	SH	SOLE	65500	0	0
TIME WARNER INC COM NEW	COM	887317303	106431	1336899	SH	SOLE	1293957	0	42942
TIME WARNER INC COM NEW	COM	887317303	117	1473	SH	OTR	0	0	1473
TIMKEN CO COM	COM	887389104	2520	71700	SH	SOLE	71700	0	0
TIMKENSTEEL CORP NOTE 6.000% 6/0	CV	887399AA1	5050	4575000	PRN	SOLE	4575000	0	0
TOLL BROTHERS INC COM	COM	889478103	3485	116700	SH	SOLE	116700	0	0
TORO CO COM	COM	891092108	14948	319122	SH	SOLE	319122	0	0
TORONTO DOMINION BK ONT NOTE 3.625% 9/1	CV	891160MJ9	15067	15000000	PRN	SOLE	14371000	0	629000
TOTAL S A SPONSORED ADR	ADR	89151E109	9294	194847	SH	SOLE	193682	0	1165
TOTAL S A SPONSORED ADR	ADR	89151E109	5	108	SH	OTR	0	0	108
TRACTOR SUPPLY CO COM	COM	892356106	9298	138056	SH	SOLE	138056	0	0
TRANSDIGM GROUP INC COM	COM	893641100	7936	27449	SH	SOLE	27449	0	0
TRANSUNION COM	COM	89400J107	48399	1402875	SH	SOLE	1382838	0	20037
TRIMBLE NAVIGATION LTD COM	COM	896239100	34105	1194145	SH	SOLE	1194145	0	0
TRINITY INDS INC NOTE 3.875% 6/0	CV	896522AF6	11238	9365000	PRN	SOLE	9365000	0	0
TUPPERWARE BRANDS CORP COM	COM	899896104	18689	285900	SH	SOLE	285900	0	0
TWENTY FIRST CENTY FOX INC CL A	COM	90130A101	1196	49400	SH	SOLE	49400	0	0
TWILIO INC CL A	COM	90138F102	19296	299815	SH	SOLE	294504	0	5311
II VI INC COM	COM	902104108	5840	240035	SH	SOLE	240035	0	0
II VI INC COM	COM	902104108	1351	55512	SH	OTR	55512	0	0
2U INC COM	COM	90214J101	84826	2215346	SH	SOLE	2177051	0	38295
2U INC COM	COM	90214J101	536	14009	SH	OTR	14009	0	0
TYLER TECHNOLOGIES INC COM	COM	902252105	10466	61125	SH	SOLE	61125	0	0
TYSON FOODS INC CL A	COM	902494103	14837	198700	SH	SOLE	198700	0	0
TYSON FOODS INC UNIT 99/99/9999	CVPFD	902494301	7586	92669	SH	SOLE	92669	0	0
UDR INC COM	COM	902653104	53474	1485814	SH	SOLE	1485814	0	0
UGI CORP NEW COM	COM	902681105	12932	285850	SH	SOLE	285850	0	0
U S CONCRETE INC COM NEW	COM	90333L201	5929	128701	SH	SOLE	128701	0	0
U S CONCRETE INC COM NEW	COM	90333L201	991	21506	SH	OTR	21506	0	0
U S PHYSICAL THERAPY INC COM	COM	90337L108	6774	108039	SH	SOLE	108039	0	0
U S PHYSICAL THERAPY INC COM	COM	90337L108	1552	24747	SH	OTR	24747	0	0
U S SILICA HLDGS INC COM	COM	90346E103	25063	538296	SH	SOLE	538296	0	0
ULTA SALON COSMETCS  FRAG I COM	COM	90384S303	33623	141285	SH	SOLE	141285	0	0
ULTIMATE SOFTWARE GROUP INC COM	COM	90385D107	38065	186237	SH	SOLE	182580	0	3657
ULTRAGENYX PHARMACEUTICAL IN COM	COM	90400D108	11150	157176	SH	SOLE	153086	0	4090
UNION PAC CORP COM	COM	907818108	65589	672500	SH	SOLE	672500	0	0
UNITED TECHNOLOGIES CORP COM	COM	913017109	150886	1485100	SH	SOLE	1485100	0	0
UNITEDHEALTH GROUP INC COM	COM	91324P102	132421	945866	SH	SOLE	924935	0	20931
UNITEDHEALTH GROUP INC COM	COM	91324P102	105	748	SH	OTR	0	0	748
UNIVERSAL DISPLAY CORP COM	COM	91347P105	16657	300066	SH	SOLE	292258	0	7808
UNIVERSAL ELECTRS INC COM	COM	913483103	26350	353886	SH	SOLE	347657	0	6229
UNIVERSAL ELECTRS INC COM	COM	913483103	1925	25853	SH	OTR	25853	0	0
UNIVERSAL FST PRODS INC COM	COM	913543104	5802	58911	SH	SOLE	58911	0	0
UNUM GROUP COM	COM	91529Y106	28894	818300	SH	SOLE	818300	0	0
VCA INC COM	COM	918194101	29324	419033	SH	SOLE	412614	0	6419
V F CORP COM	COM	918204108	10280	183400	SH	SOLE	183400	0	0
VAIL RESORTS INC COM	COM	91879Q109	63776	406526	SH	SOLE	403128	0	3398
VALERO ENERGY CORP NEW COM	COM	91913Y100	77536	1462950	SH	SOLE	1462950	0	0
VANECK VECTORS ETF TR JR GOLD MINERS E	ETF	92189F791	12081	272778	SH	SOLE	272778	0	0
VANTIV INC CL A	COM	92210H105	43742	777365	SH	SOLE	730326	0	47039
VASCULAR SOLUTIONS INC COM	COM	92231M109	8895	184435	SH	SOLE	184435	0	0
VASCULAR SOLUTIONS INC COM	COM	92231M109	2061	42733	SH	OTR	42733	0	0
VEEVA SYS INC CL A COM	COM	922475108	119451	2893669	SH	SOLE	2853836	0	39833
VENTAS INC COM	COM	92276F100	12290	174000	SH	SOLE	174000	0	0
VERISIGN INC SDCV 3.250% 8/1	CV	92343EAD4	23460	10214000	PRN	SOLE	10214000	0	0
VERIZON COMMUNICATIONS INC COM	COM	92343V104	186317	3584406	SH	SOLE	3568928	0	15478
VERSUM MATLS INC COM	COM	92532W103	8524	375500	SH	SOLE	375500	0	0
VIPSHOP HLDGS LTD NOTE 1.500% 3/1	CV	92763WAA1	9734	9003000	PRN	SOLE	9003000	0	0
VISA INC COM CL A	COM	92826C839	60392	730257	SH	SOLE	730257	0	0
VISHAY PRECISION GROUP INC COM	COM	92835K103	2349	146512	SH	SOLE	146512	0	0
VORNADO RLTY TR SH BEN INT	COM	929042109	95269	941304	SH	SOLE	919910	0	21394
VORNADO RLTY TR SH BEN INT	COM	929042109	84	828	SH	OTR	0	0	828
VOYA FINL INC COM	COM	929089100	3225	111900	SH	SOLE	111900	0	0
VULCAN MATLS CO COM	COM	929160109	25576	224885	SH	SOLE	224885	0	0
WD-40 CO COM	COM	929236107	3587	31903	SH	SOLE	31903	0	0
WEC ENERGY GROUP INC COM	COM	92939U106	82988	1385900	SH	SOLE	1385900	0	0
WABTEC CORP COM	COM	929740108	51828	634754	SH	SOLE	596080	0	38674
WAGEWORKS INC COM	COM	930427109	67569	1109321	SH	SOLE	1088101	0	21220
WAL-MART STORES INC COM	COM	931142103	117098	1623650	SH	SOLE	1623650	0	0
WALGREENS BOOTS ALLIANCE INC COM	COM	931427108	129269	1603440	SH	SOLE	1603440	0	0
WATSCO INC COM	COM	942622200	36320	257770	SH	SOLE	254148	0	3622
WAYFAIR INC CL A	COM	94419L101	22615	574426	SH	SOLE	559439	0	14987
WEATHERFORD INTL LTD NOTE 5.875% 7/0	CV	947075AH0	7019	6243000	PRN	SOLE	6243000	0	0
WEB COM GROUP INC NOTE 1.000% 8/1	CV	94733AAA2	14589	15286000	PRN	SOLE	15286000	0	0
WEBSTER FINL CORP CONN COM	COM	947890109	141657	3726836	SH	SOLE	3594152	0	132684
WEBSTER FINL CORP CONN COM	COM	947890109	92	2424	SH	OTR	0	0	2424
WEIBO CORP SPONSORED ADR	ADR	948596101	10780	215000	SH	SOLE	215000	0	0
WELLS FARGO  CO NEW COM	COM	949746101	17942	405197	SH	SOLE	389359	0	15838
WELLS FARGO  CO NEW COM	COM	949746101	107	2423	SH	OTR	0	0	2423
WELLS FARGO  CO NEW PERP PFD CNV A	CVPFD	949746804	35733	27306	SH	SOLE	27306	0	0
WELLTOWER INC COM	COM	95040Q104	3552	47500	SH	SOLE	47500	0	0
WEST PHARMACEUTICAL SVSC INC COM	COM	955306105	25550	342950	SH	SOLE	342950	0	0
WESTERN ALLIANCE BANCORP COM	COM	957638109	110870	2953379	SH	SOLE	2803972	0	149407
WESTERN UN CO COM	COM	959802109	47307	2272200	SH	SOLE	2272200	0	0
WESTROCK CO COM	COM	96145D105	69708	1437878	SH	SOLE	1377564	0	60314
WHIRLPOOL CORP COM	COM	963320106	140068	863765	SH	SOLE	863765	0	0
WHITING PETE CORP NEW COM	COM	966387102	1504	172100	SH	SOLE	172100	0	0
WILLIAMS COS INC DEL COM	COM	969457100	59186	1925994	SH	SOLE	1925994	0	0
WINGSTOP INC COM	COM	974155103	5757	196482	SH	SOLE	196482	0	0
WINGSTOP INC COM	COM	974155103	1319	45006	SH	OTR	45006	0	0
WISDOMTREE INVTS INC COM	COM	97717P104	8571	832984	SH	SOLE	810931	0	22053
WISDOMTREE TR JAPN HEDGE EQT	ETF	97717W851	46330	1079710	SH	SOLE	1079710	0	0
WORKDAY INC CL A	COM	98138H101	17226	187867	SH	SOLE	187867	0	0
WORKDAY INC NOTE 0.750% 7/1	CV	98138HAC5	2471	2000000	PRN	SOLE	2000000	0	0
WORKDAY INC NOTE 1.500% 7/1	CV	98138HAD3	9552	7337000	PRN	SOLE	7337000	0	0
WORTHINGTON INDS INC COM	COM	981811102	15055	313440	SH	SOLE	313440	0	0
WPX ENERGY INC COM	COM	98212B103	14934	1132229	SH	SOLE	1132229	0	0
WPX ENERGY INC PFD SER A CV	CVPFD	98212B202	6539	105144	SH	SOLE	105144	0	0
WRIGHT MED GROUP INC NOTE 2.000% 2/1	CV	98235TAE7	12090	11266000	PRN	SOLE	11266000	0	0
WYNDHAM WORLDWIDE CORP COM	COM	98310W108	19537	290168	SH	SOLE	290168	0	0
WYNN RESORTS LTD COM	COM	983134107	61408	630343	SH	SOLE	630343	0	0
XACTLY CORP COM	COM	98386L101	4725	321022	SH	SOLE	321022	0	0
XACTLY CORP COM	COM	98386L101	1091	74129	SH	OTR	74129	0	0
XCEL ENERGY INC COM	COM	98389B100	3690	89700	SH	SOLE	89700	0	0
XENCOR INC COM	COM	98401F105	3454	141021	SH	SOLE	141021	0	0
XENCOR INC COM	COM	98401F105	803	32795	SH	OTR	32795	0	0
XEROX CORP COM	COM	984121103	38703	3820597	SH	SOLE	3820597	0	0
XYLEM INC COM	COM	98419M100	11342	216245	SH	SOLE	216245	0	0
YAHOO INC NOTE 12/0	CV	984332AF3	34680	33711000	PRN	SOLE	33711000	0	0
YUM BRANDS INC COM	COM	988498101	59775	658241	SH	SOLE	637543	0	20698
YUM BRANDS INC COM	COM	988498101	67	742	SH	OTR	0	0	742
ZAYO GROUP HLDGS INC COM	COM	98919V105	78831	2653359	SH	SOLE	2456932	0	196427
ZELTIQ AESTHETICS INC COM	COM	98933Q108	97397	2483361	SH	SOLE	2437224	0	46137
ZELTIQ AESTHETICS INC COM	COM	98933Q108	1216	31015	SH	OTR	31015	0	0
ZENDESK INC COM	COM	98936J101	67766	2206634	SH	SOLE	2163277	0	43357
ZIMMER BIOMET HLDGS INC COM	COM	98956P102	8048	61900	SH	SOLE	61900	0	0
ZOETIS INC CL A	COM	98978V103	14234	273681	SH	SOLE	273681	0	0
ALLEGION PUB LTD CO ORD SHS	COM	G0176J109	8838	128254	SH	SOLE	128254	0	0
ALLERGAN PLC SHS	COM	G0177J108	44747	194290	SH	SOLE	187450	0	6840
ALLERGAN PLC SHS	COM	G0177J108	72	313	SH	OTR	0	0	313
ALLERGAN PLC PFD CONV SER A	CVPFD	G0177J116	32126	39100	SH	SOLE	39100	0	0
AMDOCS LTD SHS	COM	G02602103	57792	998994	SH	SOLE	925032	0	73962
AMBARELLA INC SHS	COM	G037AX101	30103	408947	SH	SOLE	398396	0	10551
ARCH CAP GROUP LTD ORD	COM	G0450A105	107009	1350096	SH	SOLE	1273237	0	76859
ARGO GROUP INTL HLDGS LTD COM	COM	G0464B107	15275	270742	SH	SOLE	270742	0	0
ARRIS INTL INC SHS	COM	G0551A103	67289	2375193	SH	SOLE	2227201	0	147992
ATLASSIAN CORP PLC CL A	COM	G06242104	71565	2387887	SH	SOLE	2355424	0	32463
AXIS CAPITAL HOLDINGS LTD SHS	COM	G0692U109	7367	135600	SH	SOLE	135600	0	0
ACCENTURE PLC IRELAND SHS CLASS A	COM	G1151C101	68394	559824	SH	SOLE	559824	0	0
MIMECAST LTD ORD SHS	COM	G14838109	2716	142000	SH	SOLE	142000	0	0
MIMECAST LTD ORD SHS	COM	G14838109	631	33000	SH	OTR	33000	0	0
BUNGE LIMITED COM	COM	G16962105	31596	533452	SH	SOLE	533452	0	0
CARDTRONICS PLC SHS CL A	COM	G1991C105	75098	1683805	SH	SOLE	1603779	0	80026
COCA COLA EUROPEAN PARTNERS SHS	COM	G25839104	38104	954982	SH	SOLE	952508	0	2474
COCA COLA EUROPEAN PARTNERS SHS	COM	G25839104	9	214	SH	OTR	0	0	214
EATON CORP PLC SHS	COM	G29183103	100050	1522600	SH	SOLE	1522600	0	0
ENDURANCE SPECIALTY HLDGS LT SHS	COM	G30397106	28548	436178	SH	SOLE	436178	0	0
ESSENT GROUP LTD COM	COM	G3198U102	53180	1998490	SH	SOLE	1887828	0	110662
EVEREST RE GROUP LTD COM	COM	G3223R108	8910	46900	SH	SOLE	46900	0	0
FABRINET SHS	COM	G3323L100	4143	92904	SH	SOLE	92904	0	0
FABRINET SHS	COM	G3323L100	957	21453	SH	OTR	21453	0	0
GASLOG LTD SHS	COM	G37585109	40067	2753771	SH	SOLE	2690670	0	63101
GASLOG LTD SHS	COM	G37585109	1025	70416	SH	OTR	70416	0	0
INGERSOLL-RAND PLC SHS	COM	G47791101	44566	655957	SH	SOLE	655957	0	0
INVESCO LTD SHS	COM	G491BT108	157572	5039064	SH	SOLE	5003078	0	35986
JAMES RIV GROUP LTD COM	COM	G5005R107	6101	168543	SH	SOLE	168543	0	0
JOHNSON CTLS INTL PLC SHS	COM	G51502105	111416	2394505	SH	SOLE	2394505	0	0
MALLINCKRODT PUB LTD CO SHS	COM	G5785G107	46213	662273	SH	SOLE	662273	0	0
MEDTRONIC PLC SHS	COM	G5960L103	121115	1401794	SH	SOLE	1401794	0	0
NIELSEN HLDGS PLC SHS EUR	COM	G6518L108	7364	137472	SH	SOLE	137472	0	0
NORWEGIAN CRUISE LINE HLDGS SHS	COM	G66721104	10203	270631	SH	SOLE	270631	0	0
RENAISSANCERE HOLDINGS LTD COM	COM	G7496G103	113492	944511	SH	SOLE	894326	0	50185
ROWAN COMPANIES PLC SHS CL A	COM	G7665A101	11491	758000	SH	SOLE	758000	0	0
PENTAIR PLC SHS	COM	G7S00T104	28773	447900	SH	SOLE	447900	0	0
STERIS PLC SHS USD	COM	G84720104	60943	833691	SH	SOLE	784715	0	48976
VALIDUS HOLDINGS LTD COM SHS	COM	G9319H102	2914	58500	SH	SOLE	58500	0	0
XL GROUP LTD COM	COM	G98294104	123826	3682023	SH	SOLE	3682023	0	0
ALLIED WRLD ASSUR COM HLDG A SHS	COM	H01531104	31096	769310	SH	SOLE	769310	0	0
CHUBB LIMITED COM	COM	H1467J104	183235	1458299	SH	SOLE	1418025	0	40274
CHUBB LIMITED COM	COM	H1467J104	188	1496	SH	OTR	0	0	1496
GLOBANT S A COM	COM	L44385109	3162	75072	SH	SOLE	75072	0	0
GLOBANT S A COM	COM	L44385109	730	17335	SH	OTR	17335	0	0
TRINSEO S A SHS	COM	L9340P101	51262	906338	SH	SOLE	853542	0	52796
CYBERARK SOFTWARE LTD SHS	COM	M2682V108	4179	84315	SH	SOLE	84315	0	0
MELLANOX TECHNOLOGIES LTD SHS	COM	M51363113	8679	200660	SH	SOLE	195424	0	5236
ORBOTECH LTD ORD	COM	M75253100	39039	1318430	SH	SOLE	1318430	0	0
WIX COM LTD SHS	COM	M98068105	76107	1752403	SH	SOLE	1713609	0	38794
WIX COM LTD SHS	COM	M98068105	1076	24777	SH	OTR	24777	0	0
CIMPRESS N V SHS EURO	COM	N20146101	18679	184616	SH	SOLE	179837	0	4779
MOBILEYE N V AMSTELVEEN ORD SHS	COM	N51488117	10211	239860	SH	SOLE	239860	0	0
LYONDELLBASELL INDUSTRIES N SHS - A -	COM	N53745100	106596	1321550	SH	SOLE	1294567	0	26983
LYONDELLBASELL INDUSTRIES N SHS - A -	COM	N53745100	59	729	SH	OTR	0	0	729
PATHEON N V SHS	COM	N6865W105	29817	1006301	SH	SOLE	989440	0	16861
ROYAL CARIBBEAN CRUISES LTD COM	COM	V7780T103	30384	405390	SH	SOLE	405390	0	0
BROADCOM LTD SHS	COM	Y09827109	53855	312165	SH	SOLE	310992	0	1173
